{
  "full_name": "DEXMAXILION URBAN DESIDELEO",
  "email": "TEEST@gmail.com",
  "phone": "9 999999999",
  "linkedin": "https://www.linkedin.com/in/TEST",
  "location": "Chile",
  "summary": "Técnico de Soporte TI N1–N2 con más de 7 años de experiencia en soporte presencial y remoto, atendiendo usuarios finales en entornos públicos, privados, educativos. Experiencia sólida en resolución de incidencias de hardware, software y conectividad, gestión de tickets bajo SLA y continuidad operativa. Perfil orientado a soporte en terreno y remoto, despliegue de endpoints, redes LAN/WiFi e infraestructura básica, con disponibilidad de traslado y licencia clase B.",
  "metadata": {
    "tags_hidden": []
  },
  "experience": [
    {
      "company": "SOC Opazo y Verdugo Ltda.",
      "description": "Soporte TI N2 presencial y remoto para clientes del sector público, privado y banca rio. Resolución de incidencias de hardware, software, impresoras y conectividad bajo SLA. Despliegue y masterización de equipos mediante herramientas de imaging (Clonezilla/MDT). Integración de endpoints a redes LAN, validación de servicios y habilitación de puestos de trabajo. Gestión y documentación de tickets en plataformas de soporte.",
      "skills_used": [],
      "impact_metrics": []
    },
    {
      "company": "Planeta Woo SPA",
      "description": "Soporte remoto a clientes PYMES e institucionales en software, licencias y herramientas digitales. Administración y mantenimiento de sitios WordPress y WooCommerce. Implementación y soporte funcional de sistemas ERP, CRM y facturación electrónica. Gestión de proveedores tecnológicos y documentación de procesos. Adquisiciones, Ordenes de compras, Cotizaciones a través de MercadoPublico.",
      "skills_used": [],
      "impact_metrics": []
    },
    {
      "company": "Municipalidad de Lago Verde & DAEM",
      "description": "Operación y soporte de infraestructura TI municipal y educacional (LAN, WiFi, conectividad y servicios). Configuración de estaciones de trabajo y soporte avanzado a funcionarios y personal educativo. Mantenimiento de sala de redes, cableado estructurado y activos TI. Apoyo en inventario tecnológico y coordinación de adquisiciones.",
      "skills_used": [],
      "impact_metrics": []
    },
    {
      "company": "Dimacofi",
      "description": "Mantenimiento preventivo y correctivo de equipos multifuncionales (MFP). Diagnóstico, reparación y calibración de equipos según procedimientos del fabricante. Soporte a usuarios finales en sitio.",
      "skills_used": [],
      "impact_metrics": []
    },
    {
      "company": "Axioma Integración",
      "description": "Soporte TI N1 a usuarios finales en terreno. Diagnóstico y resolución de incidencias de hardware, software y conectividad. Mantenimiento preventivo y correctivo de equipos y periféricos.",
      "skills_used": [],
      "impact_metrics": []
    }
  ],
  "education": [
    {
      "degree": "Técnico en Telecomunicaciones y Redes",
      "institution": "CFT Inacap"
    }
  ],
  "skills": {
    "hard_skills": [],
    "soft_skills": []
  },
  "languages": [
    "Inglés"
  ],
  "raw_text": "DEXMAXILION URBAN DESIDELEO  Chile  https://www.linkedin.com/in/TEST  TEEST@gmail.com  9 999999999 Resumen Técnico de Soporte TI N1–N2 con más de 7 años de experiencia en soporte presencial y remoto, atendiendo usuarios finales en entornos públicos, privados, educativos. Experiencia sólida en resolución de incidencias de hardware, software y conectividad, gestión de tickets bajo SLA y continuidad operativa. Perfil orientado a soporte en terreno y remoto, despliegue de endpoints, redes LAN/WiFi e infraestructura básica, con disponibilidad de traslado y licencia clase B. EXPERIENCE SOC Opazo y Verdugo Ltda., Técnico Soporte TI y Redes - Soporte TI N2 presencial y remoto para clientes del sector público, privado y banca rio. - Resolución de incidencias de hardware, software, impresoras y conectividad bajo SLA. - Despliegue y masterización de equipos mediante herramientas de imaging (Clonezilla/MDT). - Integración de endpoints a redes LAN, validación de servicios y habilitación de puestos de trabajo. - Gestión y documentación de tickets en plataformas de soporte. Planeta Woo SPA, Soporte TI y Soluciones Digitales - Soporte remoto a clientes PYMES e institucionales en software, licencias y herramientas digitales. - Administración y mantenimiento de sitios WordPress y WooCommerce. - Implementación y soporte funcional de sistemas ERP, CRM y facturación electrónica. - Gestión de proveedores tecnológicos y documentación de procesos. - Adquisiciones, Ordenes de compras, Cotizaciones a través de MercadoPublico. Municipalidad de Lago Verde & DAEM, Soporte TI Infraestructura Municipal y Educativa - Operación y soporte de infraestructura TI municipal y educacional (LAN, WiFi, conectividad y servicios). - Configuración de estaciones de trabajo y soporte avanzado a funcionarios y personal educativo. - Mantenimiento de sala de redes, cableado estructurado y activos TI. - Apoyo en inventario tecnológico y coordinación de adquisiciones. Dimacofi, Soporte Técnico en Terreno - Mantenimiento preventivo y correctivo de equipos multifuncionales (MFP). - Diagnóstico, reparación y calibración de equipos según procedimientos del fabricante. - Soporte a usuarios finales en sitio. Axioma Integración, Soporte Técnico en Terreno - Soporte TI N1 a usuarios finales en terreno. - Diagnóstico y resolución de incidencias de hardware, software y conectividad. - Mantenimiento preventivo y correctivo de equipos y periféricos. Coyhaique Mar 2023 – Ago 2025 Remoto Ene 2020 – Dic 2022 Lago Verde Jun 2019 – Dic 2019 Coyhaique Feb 2019 – Mayo 2019 Coyhaique Mar 2015 – Feb 2018 - Gestión de tickets y cumplimiento de SLA. EDUCATION CFT Inacap, Técnico en Telecomunicaciones y Redes Chile 2014 – 2016 CERTIFICATIONS Data Scientist con Python - Formación en análisis de datos, Python y fundamentos de ciencia de datos. Data Analyst con Python - Análisis de datos con Python, Pandas y visualización básica. Fundamentos profesionales del análisis de datos - Certificación Microsoft orientada a análisis y uso de datos. Fundamentos de la carrera de administración de sistemas - Bases de administración de sistemas y operación TI. Fundamentos profesionales en tecnología sostenible - Buenas prácticas tecnológicas y sostenibilidad. Aspectos básicos de la asistencia técnica - Fundamentos de soporte técnico y atención a usuarios. CCENT - Fundamentos de redes y routing básico. Jul 2025 Feb 2025 Jun 2025 Jun 2025 Jun 2025 Nov 2022 Nov 2014 SKILLS Soporte TI: Soporte N1/N2 presencial y remoto, atención a usuarios finales, gestión de tickets y trabajo bajo SLA Sistemas: Windows 10/11, Windows Server básico, Active Directory (usuarios y grupos) Endpoints: Despliegue, configuración y mantenimiento de estaciones de trabajo, imaging y hardening Redes: LAN, WiFi, VLAN, DHCP, DNS, NAT, troubleshooting de conectividad Herramientas: Jira, Zendesk, ServiceNow, AnyDesk, TeamViewer, SCCM Infraestructura: Cableado estructurado, racks, patch panels, UPS y soporte en terreno Otros: WordPress/WooCommerce, soporte a impresoras, inventario de activos TI Idiomas: Inglés técnico (lectura y comprensión de documentación) Otros - Disponibilidad para trabajo presencial, remoto y en terreno. - Licencia de conducir clase B. - Disponibilidad para Traslado"
}